{
  "schema_version": "research-1.0",
  "tool": {
    "name": "mobile-audit",
    "version": "0.6.0"
  },
  "generated_at": "2026-10-10T18:20:02.331655Z",
  "target": {
    "platform": "ios",
    "identifier": "org.example.synthetic",
    "name": "Synthetic Example",
    "version": "1.0"
  },
  "environment": {
    "ios_version": "18.0"
  },
  "inputs": [
    {
      "id": "source-8e2970d23e015cce",
      "kind": "static_scan",
      "sha256": "dc287fe9b8dc81996411ee5f627d547bafae6887829db9b83b4ac73d258eff5a",
      "hash_scope": "scanner_output",
      "name": "Package and source checks"
    },
    {
      "id": "source-0cc6ce7ad129d6f4",
      "kind": "ios_package",
      "sha256": "e3485ba060f7191857e5285b1e0dd102de786f36529af92b961d0edd23ea1529",
      "hash_scope": "entire_file",
      "name": "Supplied iOS package"
    },
    {
      "id": "source-bf98b7063c8b4906",
      "kind": "app_privacy_report",
      "sha256": "c5e5552164bae5da8e026fc0e6f63df7b8cee080b2a09d4b9833d8132a50a18f",
      "hash_scope": "entire_file",
      "name": "Selected-app App Privacy Report import"
    },
    {
      "id": "source-dfa19f384d291815",
      "kind": "researcher_supplied_binary",
      "sha256": "91285ed40f4d5999f487b5acd9c18f2619368c3dfb984d8e49586df0a69c7723",
      "hash_scope": "entire_file",
      "name": "Researcher-supplied Mach-O binary"
    },
    {
      "id": "source-eaa70e9fe9960184",
      "kind": "dependency_inventory",
      "sha256": "21b46dee9114db2a5b0be78951c7869ae2fe8f668b71f6614c29210991f3b79f",
      "hash_scope": "parsed_lockfile_inventory",
      "name": "Parsed dependency lockfiles"
    }
  ],
  "visibility": {
    "package_binaries": {
      "not_encrypted": 1,
      "encrypted": 1,
      "unknown": 0
    },
    "source_files_checked": 2,
    "source_like_assets_listed": 2,
    "supplied_binary": {
      "size": 187,
      "encryption": "not_encrypted",
      "architectures": [
        {
          "architecture": "arm64",
          "encryption": "not_encrypted",
          "linked_libraries": []
        }
      ]
    }
  },
  "coverage": [
    {
      "area": "package_configuration",
      "status": "observed",
      "detail": "Package configuration and entry points were scanned."
    },
    {
      "area": "source_patterns",
      "status": "observed",
      "detail": "Developer source was scanned with bounded rules."
    },
    {
      "area": "native_code",
      "status": "limited",
      "detail": "1 readable and 1 encrypted package executable(s); readable code was checked only for selected API names."
    },
    {
      "area": "app_activity",
      "status": "observed",
      "detail": "Selected-app resource and network metadata imported; request contents and causation remain unavailable."
    },
    {
      "area": "researcher_supplied_native_code",
      "status": "observed",
      "detail": "Readable Mach-O was checked for selected API-name references; binary-to-app identity and reachability were not verified."
    },
    {
      "area": "dependency_inventory",
      "status": "observed",
      "detail": "1 exact-version lockfile entries found; inclusion in the iOS build is unverified."
    },
    {
      "area": "known_advisories",
      "status": "unavailable",
      "detail": "Online advisory lookup was not requested."
    },
    {
      "area": "network_request_contents",
      "status": "unavailable",
      "detail": "No proxy or request-content capture was ingested."
    },
    {
      "area": "backend_authorization",
      "status": "unavailable",
      "detail": "No independent two-account or backend authorization test was run."
    },
    {
      "area": "native_decompilation",
      "status": "unavailable",
      "detail": "Native binary decompilation is not implemented in this release."
    },
    {
      "area": "cross_signal_review",
      "status": "limited",
      "detail": "1 paired test lead(s) generated from co-present clues; no data flow or exploit path was verified."
    }
  ],
  "evidence": [
    {
      "id": "evidence-eee6b659a6b63c21",
      "kind": "static_rule_match",
      "source_id": "source-8e2970d23e015cce",
      "locator": "App.swift:3",
      "summary": "Uses SecTrustSetExceptions",
      "details": {
        "rule_id": "IOS-CUSTOM-TRUST",
        "platform": "ios"
      }
    },
    {
      "id": "evidence-2408744c84b4b684",
      "kind": "static_rule_match",
      "source_id": "source-8e2970d23e015cce",
      "locator": "main.ts:1",
      "summary": "Dynamic code execution call found; its input and reachability are unverified",
      "details": {
        "rule_id": "IOS-WEB-DYNAMIC-CODE",
        "platform": "ios"
      }
    },
    {
      "id": "evidence-268bbd257b84fd99",
      "kind": "declared_entry_point",
      "source_id": "source-8e2970d23e015cce",
      "locator": "Payload/Example.app/Info.plist",
      "summary": "custom url scheme: exampleapp",
      "details": {}
    },
    {
      "id": "evidence-9b284e0a62408ed3",
      "kind": "declared_entry_point",
      "source_id": "source-8e2970d23e015cce",
      "locator": "Payload/Example.app/Info.plist",
      "summary": "document type: public.json",
      "details": {}
    },
    {
      "id": "evidence-ed1ee9665cbe0f37",
      "kind": "binary_api_reference",
      "source_id": "source-8e2970d23e015cce",
      "locator": "Payload/Example.app/Frameworks/Helper.dylib",
      "summary": "Readable binary references custom server trust",
      "details": {}
    },
    {
      "id": "evidence-0a10186ebde85d56",
      "kind": "binary_api_reference",
      "source_id": "source-8e2970d23e015cce",
      "locator": "Payload/Example.app/Frameworks/Helper.dylib",
      "summary": "Readable binary references external url handler",
      "details": {}
    },
    {
      "id": "evidence-fac29a0f41797f69",
      "kind": "network_contact",
      "source_id": "source-bf98b7063c8b4906",
      "locator": "obs-4a64b43e9841ef4a",
      "summary": "App-attributed contact with api.example.test",
      "details": {
        "domain": "api.example.test",
        "reported_contacts": 2
      }
    },
    {
      "id": "evidence-84b118c46789f388",
      "kind": "network_contact",
      "source_id": "source-bf98b7063c8b4906",
      "locator": "obs-f757cfad00e8ea5b",
      "summary": "App-attributed contact with cdn.example.test",
      "details": {
        "domain": "cdn.example.test",
        "reported_contacts": 1
      }
    },
    {
      "id": "evidence-8a17c29c0a9aa3d7",
      "kind": "binary_api_reference",
      "source_id": "source-dfa19f384d291815",
      "locator": "researcher-supplied Mach-O",
      "summary": "Readable binary references custom server trust",
      "details": {}
    },
    {
      "id": "evidence-7ccac848c62a0760",
      "kind": "binary_api_reference",
      "source_id": "source-dfa19f384d291815",
      "locator": "researcher-supplied Mach-O",
      "summary": "Readable binary references external url handler",
      "details": {}
    }
  ],
  "leads": [
    {
      "id": "lead-6e1b6df43f30dae8",
      "kind": "custom_server_trust",
      "title": "Custom server trust handling",
      "priority": "high",
      "confidence": "low",
      "state": "hypothesis",
      "evidence_ids": [
        "evidence-8a17c29c0a9aa3d7"
      ],
      "attacker_control": "Network endpoint and certificate presented to the app",
      "possible_impact": "Acceptance of an untrusted server identity",
      "next_test": "In an authorized test environment, verify whether an invalid server certificate is rejected.",
      "remediation_if_confirmed": "Use platform trust evaluation and reject untrusted certificates.",
      "attack_scenario": "If the app accepts an invalid server identity, someone able to present that identity on its network path could impersonate the service. An API reference alone does not show that trust is bypassed."
    },
    {
      "id": "lead-8bb575026afea643",
      "kind": "custom_server_trust",
      "title": "Custom server trust handling",
      "priority": "high",
      "confidence": "low",
      "state": "hypothesis",
      "evidence_ids": [
        "evidence-ed1ee9665cbe0f37"
      ],
      "attacker_control": "Network endpoint and certificate presented to the app",
      "possible_impact": "Acceptance of an untrusted server identity",
      "next_test": "In an authorized test environment, verify whether an invalid server certificate is rejected.",
      "remediation_if_confirmed": "Use platform trust evaluation and reject untrusted certificates.",
      "attack_scenario": "If the app accepts an invalid server identity, someone able to present that identity on its network path could impersonate the service. An API reference alone does not show that trust is bypassed."
    },
    {
      "id": "lead-0f9a9cd1c528b550",
      "kind": "external_url_handler",
      "title": "External URL handler",
      "priority": "high",
      "confidence": "low",
      "state": "hypothesis",
      "evidence_ids": [
        "evidence-0a10186ebde85d56"
      ],
      "attacker_control": "Parameters supplied through another app or browser",
      "possible_impact": "Unauthorized app action or access to protected content",
      "next_test": "Open a controlled link while signed out and under a second test account; compare authorized and unauthorized outcomes.",
      "remediation_if_confirmed": "Validate every parameter and enforce authorization in the handler.",
      "attack_scenario": "If an external link parameter reaches a protected app action without authorization, a sender could use a crafted link to invoke that action. An API-name reference does not establish a reachable handler."
    },
    {
      "id": "lead-f0311607ec8549da",
      "kind": "external_url_handler",
      "title": "External URL handler",
      "priority": "high",
      "confidence": "low",
      "state": "hypothesis",
      "evidence_ids": [
        "evidence-7ccac848c62a0760"
      ],